{"id":"5a6b7c8d-9e0f-4a1b-8c2d-3e4f5a6b7c8d","reviewId":"9d8c7b6a-5f4e-4d3c-b2a1-0f9e8d7c6b5a","state":"succeeded","intent":{"effect":"device.revoke","params":{"deviceId":"0b4e6f8a-2c3d-4e5f-8a9b-1c2d3e4f5a6b"}},"receipt":{"deviceRevoked":"0b4e6f8a-2c3d-4e5f-8a9b-1c2d3e4f5a6b"},"errorCode":null,"createdAt":"2026-10-09T10:00:00.000Z","settledAt":"2026-10-09T10:00:00.000Z","cleanup":null}
