{"id":"5a6b7c8d-9e0f-4a1b-8c2d-3e4f5a6b7c8d","reviewId":"9d8c7b6a-5f4e-4d3c-b2a1-0f9e8d7c6b5a","state":"succeeded","intent":{"effect":"archive.delete","params":{"sourceIds":["3f9a1c2e-5b7d-4e8f-9a0b-1c2d3e4f5a6b","7c1d2e3f-4a5b-4c6d-8e7f-9a0b1c2d3e4f"]}},"receipt":{"ledgerSeq":7,"ledgerRecordHash":"bbbbbbbbbbbbbbbbbbbbbbbbbbbbbbbbbbbbbbbbbbbbbbbbbbbbbbbbbbbbbbbb","sourcesDeleted":2},"errorCode":null,"createdAt":"2026-10-09T10:00:00.000Z","settledAt":"2026-10-09T10:00:00.000Z","cleanup":{"scope":"live_archive","state":"unknown","total":2,"completed":1,"failed":0,"unrecorded":1}}
